<?xml version="1.0" encoding="UTF-8"?>
<class
	xmlns:xsi="http://www.w3.org/2001/XMLSchema-instance"
	xsi:noNamespaceSchemaLocation="shared.xsd"
	name="Workload" 
	cBaseType="MultiLanguageObjectBase"
	javaBaseType="MacroDefinitionContainer"
	javaSuffix="Data"
	comment="A Workload">
	
	<field name="id" type="int" comment="id of the workload"/>
	<field name="kernel" type="KernelBase" comment="kernel to be executed" />
	<field name="measurerSet" type="MeasurerSet" comment="Measurers used to measure from begin to end of the kernel"/>
	<field name="cpu" type="int" comment="CPU the kernel should be started on. -1 means no pinning"/>
	<field name="warmCaches" type="bool" comment="if true, warm caches, if false, clear caches before running the kernel"/>
	
	<list name="waitFor" type="int" comment="ids of the workloads which must be started or killed before this one is started"/>
	<list name="killOnExit" type="int" comment="ids of the workloads to be killed when this workload exits"/>
</class>