<?xml version="1.0" encoding="UTF-8"?>
<class
	xmlns:xsi="http://www.w3.org/2001/XMLSchema-instance"
	xsi:noNamespaceSchemaLocation="shared.xsd"
	name="MultiLanguageTestClass" 
	cBaseType="MultiLanguageObjectBase"
	javaBaseType=""
	comment="Multi Language Class used for unit tests">
  <field  name="longField" type="long" comment="test field with type 'long'"/>
  <field  name="intField" type="int" comment="test field with type 'int'"/>
  <field  name="boolField" type="bool" comment="test field with type 'bool'"/>
  <field  name="doubleField" type="double" comment="test field with type 'double'"/>
  <field  name="stringField" type="string" comment="test field with type 'string'"/>
  
  <list  name="primitiveList" type="int" comment="list referencing ints"/>
  <list  name="referenceList" type="MultiLanguageTestClass" comment="list referencing full classes"/>
  
  <field name="referenceField" type="MultiLanguageTestClass" comment="field referencing another class"/>
</class>